{
 "schema": "device-spec/1.0",
 "name": "deg_ill_safety_blur",
 "image": "deg_ill_safety_blur.jpg",
 "scale": {
  "mm_per_px": 0.0635
 },
 "body_px": [
  56.0,
  56.0,
  816.0,
  1816.0
 ],
 "preset": "illustration",
 "graphics": true,
 "pins": [
  {
   "name": "A1",
   "side": "top",
   "x_px": 156.0,
   "y_px": 148.0,
   "group": "P3"
  },
  {
   "name": "S31",
   "side": "top",
   "x_px": 316.0,
   "y_px": 148.0,
   "group": "P3"
  },
  {
   "name": "S32",
   "side": "top",
   "x_px": 396.0,
   "y_px": 148.0,
   "group": "P3"
  },
  {
   "name": "13",
   "side": "top",
   "x_px": 476.0,
   "y_px": 148.0,
   "group": "P3"
  },
  {
   "name": "23",
   "side": "top",
   "x_px": 556.0,
   "y_px": 148.0,
   "group": "P3"
  },
  {
   "name": "33",
   "side": "top",
   "x_px": 636.0,
   "y_px": 148.0,
   "group": "P3"
  },
  {
   "name": "41",
   "side": "top",
   "x_px": 716.0,
   "y_px": 148.0,
   "group": "P3"
  },
  {
   "name": "S11",
   "side": "top",
   "x_px": 156.0,
   "y_px": 300.0,
   "group": "P4"
  },
  {
   "name": "S12",
   "side": "top",
   "x_px": 236.0,
   "y_px": 300.0,
   "group": "P4"
  },
  {
   "name": "S13",
   "side": "top",
   "x_px": 316.0,
   "y_px": 300.0,
   "group": "P4"
  },
  {
   "name": "S14",
   "side": "top",
   "x_px": 396.0,
   "y_px": 300.0,
   "group": "P4"
  },
  {
   "name": "S21",
   "side": "top",
   "x_px": 476.0,
   "y_px": 300.0,
   "group": "P4"
  },
  {
   "name": "S22",
   "side": "top",
   "x_px": 556.0,
   "y_px": 300.0,
   "group": "P4"
  },
  {
   "name": "S33",
   "side": "top",
   "x_px": 636.0,
   "y_px": 300.0,
   "group": "P4"
  },
  {
   "name": "S34",
   "side": "top",
   "x_px": 716.0,
   "y_px": 300.0,
   "group": "P4"
  },
  {
   "name": "A2",
   "side": "bottom",
   "x_px": 156.0,
   "y_px": 1724.0,
   "group": "P4b"
  },
  {
   "name": "Y30",
   "side": "bottom",
   "x_px": 236.0,
   "y_px": 1724.0,
   "group": "P4b"
  },
  {
   "name": "Y31",
   "side": "bottom",
   "x_px": 316.0,
   "y_px": 1724.0,
   "group": "P4b"
  },
  {
   "name": "Y32",
   "side": "bottom",
   "x_px": 396.0,
   "y_px": 1724.0,
   "group": "P4b"
  },
  {
   "name": "14",
   "side": "bottom",
   "x_px": 476.0,
   "y_px": 1724.0,
   "group": "P4b"
  },
  {
   "name": "24",
   "side": "bottom",
   "x_px": 556.0,
   "y_px": 1724.0,
   "group": "P4b"
  },
  {
   "name": "34",
   "side": "bottom",
   "x_px": 636.0,
   "y_px": 1724.0,
   "group": "P4b"
  },
  {
   "name": "42",
   "side": "bottom",
   "x_px": 716.0,
   "y_px": 1724.0,
   "group": "P4b"
  }
 ]
}